{
  "$schema": "./schema/techs.schema.json",
  "version": "1.0",
  "notes": [
    "Граф технологий — направленный ациклический граф (DAG), а не дерево: у узла может быть",
    "несколько предпосылок, ветки переплетаются между собой.",
    "",
    "ВАЖНО ПРО БУТСТРАП. Всё, что нужно для производства самих научных данных, обязано быть",
    "доступно с нулевого тика, иначе граф замыкается сам на себя:",
    "  research_physics     требует кристаллы     → crystal_mine на старте",
    "  research_engineering требует сплавы и электронику → alloy_works, electronics_plant на старте",
    "  research_bio         требует медикаменты   → pharma_plant, farm, water_plant на старте",
    "Технологии этих веток дают не доступ, а модификаторы выхода. Добыча редкого сырья тоже",
    "открыта изначально: редкость возникает из географии месторождений, а не из уровня науки.",
    "",
    "Повторяемые технологии в конце каждой ветки обязательны: без них фракция доисследует",
    "всё и застынет, а для партии на 10 000 лет это смерть."
  ],
  "branches": [
    {
      "id": "energy",
      "name": "Энергетика",
      "primaryData": "physics"
    },
    {
      "id": "propulsion",
      "name": "Двигательные системы",
      "primaryData": "engineering"
    },
    {
      "id": "kinetic",
      "name": "Кинетическое вооружение",
      "primaryData": "engineering"
    },
    {
      "id": "beams",
      "name": "Энергетическое вооружение",
      "primaryData": "physics"
    },
    {
      "id": "missiles",
      "name": "Ракетное вооружение",
      "primaryData": "engineering"
    },
    {
      "id": "defense",
      "name": "Защита",
      "primaryData": "mixed"
    },
    {
      "id": "hulls",
      "name": "Корпуса и верфестроение",
      "primaryData": "engineering"
    },
    {
      "id": "industry",
      "name": "Добыча и переработка",
      "primaryData": "engineering"
    },
    {
      "id": "biology",
      "name": "Биология и жизнеобеспечение",
      "primaryData": "bio"
    },
    {
      "id": "colonization",
      "name": "Колонизация и терраформирование",
      "primaryData": "bio"
    },
    {
      "id": "logistics",
      "name": "Логистика",
      "primaryData": "engineering"
    },
    {
      "id": "cybernetics",
      "name": "Кибернетика",
      "primaryData": "mixed"
    },
    {
      "id": "administration",
      "name": "Администрация и связь",
      "primaryData": "mixed"
    }
  ],
  "costModel": {
    "comment": "Ориентиры суммарной стоимости по тирам. Кривая ×5 за шаг — круче, чем ×3 в первой редакции: при ней всё дерево исследовалось за 20 лет, то есть технологическая эпоха заканчивалась раньше, чем фракции успевали столкнуться.",
    "tier1": 800,
    "tier2": 4800,
    "tier3": 35700,
    "tier4": 200000,
    "tier5": 980000,
    "repeatBase": "≈40 000, рост ×1.22 за уровень (администрация ×1.20)",
    "targetPacing": "тир 1 к ~15 году, тир 2 к ~60, тир 3 к ~250, тир 4 к ~400. Дальше только повторяемые."
  },
  "techs": [
    {
      "id": "start",
      "name": "Наследие предков",
      "branch": "industry",
      "tier": 0,
      "phase": 1,
      "requires": [],
      "cost": {},
      "effects": [
        {
          "type": "unlockHull",
          "id": "shuttle"
        },
        {
          "type": "unlockHull",
          "id": "corvette"
        },
        {
          "type": "unlockHull",
          "id": "freighter"
        },
        {
          "type": "unlockHull",
          "id": "prospector"
        },
        {
          "type": "unlockModule",
          "id": "reactor_t1"
        },
        {
          "type": "unlockModule",
          "id": "thruster_t1"
        },
        {
          "type": "unlockModule",
          "id": "kinetic_t1"
        },
        {
          "type": "unlockModule",
          "id": "missile_t1"
        },
        {
          "type": "unlockModule",
          "id": "armor_t1"
        },
        {
          "type": "unlockModule",
          "id": "cargo_t1"
        },
        {
          "type": "unlockModule",
          "id": "sensor_t1"
        },
        {
          "type": "unlockModule",
          "id": "fuel_tank_t1"
        },
        {
          "type": "unlockModule",
          "id": "quarters_t1"
        },
        {
          "type": "unlockModule",
          "id": "mining_rig_t1"
        },
        {
          "type": "unlockBuilding",
          "id": "mine"
        },
        {
          "type": "unlockBuilding",
          "id": "ice_drill"
        },
        {
          "type": "unlockBuilding",
          "id": "gas_collector"
        },
        {
          "type": "unlockBuilding",
          "id": "quarry"
        },
        {
          "type": "unlockBuilding",
          "id": "farm"
        },
        {
          "type": "unlockBuilding",
          "id": "rare_earth_mine"
        },
        {
          "type": "unlockBuilding",
          "id": "crystal_mine"
        },
        {
          "type": "unlockBuilding",
          "id": "radioactive_mine"
        },
        {
          "type": "unlockBuilding",
          "id": "smelter"
        },
        {
          "type": "unlockBuilding",
          "id": "water_plant"
        },
        {
          "type": "unlockBuilding",
          "id": "refinery"
        },
        {
          "type": "unlockBuilding",
          "id": "food_plant"
        },
        {
          "type": "unlockBuilding",
          "id": "polymer_plant"
        },
        {
          "type": "unlockBuilding",
          "id": "ceramics_plant"
        },
        {
          "type": "unlockBuilding",
          "id": "pharma_plant"
        },
        {
          "type": "unlockBuilding",
          "id": "alloy_works"
        },
        {
          "type": "unlockBuilding",
          "id": "electronics_plant"
        },
        {
          "type": "unlockBuilding",
          "id": "reactor_works"
        },
        {
          "type": "unlockBuilding",
          "id": "thruster_works"
        },
        {
          "type": "unlockBuilding",
          "id": "weapon_works"
        },
        {
          "type": "unlockBuilding",
          "id": "armor_works"
        },
        {
          "type": "unlockBuilding",
          "id": "lifesupport_works"
        },
        {
          "type": "unlockBuilding",
          "id": "consumer_plant"
        },
        {
          "type": "unlockBuilding",
          "id": "hull_yard"
        },
        {
          "type": "unlockBuilding",
          "id": "shipyard"
        },
        {
          "type": "unlockBuilding",
          "id": "physics_lab"
        },
        {
          "type": "unlockBuilding",
          "id": "engineering_lab"
        },
        {
          "type": "unlockBuilding",
          "id": "bio_lab"
        },
        {
          "type": "unlockBuilding",
          "id": "solar_array"
        },
        {
          "type": "unlockBuilding",
          "id": "housing"
        }
      ]
    },
    {
      "id": "materials_alloys",
      "name": "Промышленная металлургия",
      "branch": "industry",
      "tier": 1,
      "phase": 1,
      "requires": [
        "start"
      ],
      "cost": {
        "engineering": 880
      },
      "effects": [
        {
          "type": "modifier",
          "target": "recipe:forge_alloys",
          "stat": "outputMultiplier",
          "value": 1.25
        }
      ]
    },
    {
      "id": "microelectronics",
      "name": "Микроэлектроника",
      "branch": "industry",
      "tier": 1,
      "phase": 1,
      "requires": [
        "start"
      ],
      "cost": {
        "engineering": 800,
        "physics": 320
      },
      "effects": [
        {
          "type": "modifier",
          "target": "recipe:make_electronics",
          "stat": "outputMultiplier",
          "value": 1.25
        }
      ]
    },
    {
      "id": "ceramics_industry",
      "name": "Промышленная керамика",
      "branch": "industry",
      "tier": 1,
      "phase": 1,
      "requires": [
        "start"
      ],
      "cost": {
        "engineering": 640
      },
      "effects": [
        {
          "type": "modifier",
          "target": "recipe:fire_ceramics",
          "stat": "outputMultiplier",
          "value": 1.3
        }
      ]
    },
    {
      "id": "composite_materials",
      "name": "Композитные материалы",
      "branch": "industry",
      "tier": 2,
      "phase": 1,
      "requires": [
        "materials_alloys",
        "ceramics_industry"
      ],
      "cost": {
        "engineering": 4500
      },
      "effects": [
        {
          "type": "unlockBuilding",
          "id": "composite_plant"
        }
      ]
    },
    {
      "id": "optics_manufacturing",
      "name": "Прецизионная оптика",
      "branch": "industry",
      "tier": 2,
      "phase": 1,
      "requires": [
        "microelectronics"
      ],
      "cost": {
        "physics": 3800,
        "engineering": 1100
      },
      "effects": [
        {
          "type": "unlockBuilding",
          "id": "optics_plant"
        }
      ]
    },
    {
      "id": "radioactive_refining",
      "name": "Обогащение радиоактивов",
      "branch": "industry",
      "tier": 2,
      "phase": 1,
      "requires": [
        "start",
        "materials_alloys"
      ],
      "cost": {
        "physics": 4000,
        "engineering": 1900
      },
      "effects": [
        {
          "type": "unlockBuilding",
          "id": "enrichment_plant"
        },
        {
          "type": "unlockBuilding",
          "id": "fission_plant"
        }
      ]
    },
    {
      "id": "superconduction",
      "name": "Сверхпроводимость",
      "branch": "energy",
      "tier": 2,
      "phase": 1,
      "requires": [
        "radioactive_refining",
        "optics_manufacturing"
      ],
      "cost": {
        "physics": 6100,
        "engineering": 1400
      },
      "effects": [
        {
          "type": "unlockBuilding",
          "id": "sc_plant"
        }
      ]
    },